{
  "owns": [
    {
      "type": "own",
      "capitalShares": 30.0,
      "held": {
        "name": "Panzer Vermögensverwaltung GmbH & Co KG",
        "squuid": "5be1a6b6-0b45-440e-80ae-66ded3928a70"
      },
      "squuid": "5be1a6b8-ce6f-4b17-bf59-213e638b4829",
      "state": "active"
    }
  ],
  "state": "active",
  "city": "Regensburg",
  "pseudoCompany": false,
  "name": "Panzer, Florian",
  "naturalPerson": true,
  "squuid": "5be1a6b6-f3d7-472d-bc6a-32b9a4a18617",
  "controlDate": "2019-05-17T14:30:31.618Z",
  "organizations": [
    {
      "squuid": "5adf79c8-9f9e-4b59-a86f-7119603efa99",
      "name": "DL",
      "type": "organization"
    },
    {
      "squuid": "5adf79c9-1b57-44c7-a29d-9130ab140fa9",
      "name": "GGS",
      "type": "organization",
      "fullName": "Gemeinsame Geschaeftsstelle"
    },
    {
      "squuid": "5b0830ad-2ee5-49b4-b028-a4613bb01c2e",
      "name": "mabb",
      "type": "organization",
      "fullName": "Medienanstalt Berlin-Brandenburg"
    },
    {
      "squuid": "5b0830c1-8ded-40dd-9d37-2a1a21efaff5",
      "name": "BLM",
      "type": "organization",
      "fullName": "Bayerische Landeszentrale für neue Medien"
    },
    {
      "squuid": "5b0830d3-6eed-43cd-8b57-958937d68a9f",
      "name": "Medienanstalt Hessen",
      "type": "organization",
      "fullName": "Medienanstalt Hessen"
    },
    {
      "squuid": "5b0830d9-f42f-4d90-b6c6-972961be484a",
      "name": "LMS",
      "type": "organization",
      "fullName": "Landesmedienanstalt Saarland"
    },
    {
      "squuid": "5b0830e0-995b-4e41-bc1e-678fbd483756",
      "name": "LFK",
      "type": "organization",
      "fullName": "Landesanstalt für Kommunikation Baden-Württemberg"
    },
    {
      "squuid": "5b0830ee-abe8-41d3-b591-862c1133d63d",
      "name": "SLM",
      "type": "organization",
      "fullName": "Sächsische Landesanstalt für privaten Rundfunk und neue Medien"
    },
    {
      "squuid": "5b0830f6-6588-43fb-93a8-d824a4663969",
      "name": "LFM NRW",
      "type": "organization",
      "fullName": "Landesanstalt für Medien Nordrhein-Westfalen"
    },
    {
      "squuid": "5b08310a-5980-45c0-b994-009426dae8df",
      "name": "MA HSH",
      "type": "organization",
      "fullName": "Medienanstalt Hamburg/Schleswig-Holstein"
    }
  ],
  "credits": "IJK"
}