{
  "owns": [
    {
      "type": "own",
      "capitalShares": 8.15,
      "held": {
        "name": "Leipziger Verlags- und Druckereigesellschaft mbH & Co. KG",
        "squuid": "5be1a6b6-e3d7-48f4-a702-9fec71b10041"
      },
      "squuid": "5be1a6b8-541a-474a-8d58-7bfd85866f02",
      "state": "active"
    },
    {
      "type": "own",
      "capitalShares": 8.16,
      "held": {
        "name": "Leipziger Verlags-und Druckerei-Verwaltungs GmbH",
        "squuid": "5ec504c6-13b0-4ffe-b0b8-9b717b6509b7"
      },
      "squuid": "5eccee2f-be5f-425d-b8e1-8a42cd905311",
      "state": "active"
    }
  ],
  "state": "active",
  "city": "Hannover",
  "pseudoCompany": false,
  "street": "August-Madsack-Str.",
  "name": "Leipziger Medien Beteiligungs eGbR",
  "naturalPerson": false,
  "squuid": "5be1a6b6-35cf-4341-a28b-871cf6cab0f7",
  "controlDate": "2026-10-29T12:06:03.991Z",
  "streetNumber": "1",
  "organizations": [
    {
      "squuid": "5adf79c8-9f9e-4b59-a86f-7119603efa99",
      "name": "DL",
      "type": "organization"
    },
    {
      "squuid": "5b0830ee-abe8-41d3-b591-862c1133d63d",
      "name": "SLM",
      "type": "organization",
      "fullName": "Sächsische Landesanstalt für privaten Rundfunk und neue Medien"
    }
  ],
  "zipcode": "30559",
  "credits": "IJK",
  "ownedBy": [
    {
      "type": "own",
      "capitalShares": 12.27,
      "holder": {
        "name": "Cellesche Zeitung Schweiger & Pick Verlag Pfingsten GmbH & Co. KG",
        "squuid": "5be1a6b6-1830-46a1-ac52-73c3fa740a75"
      },
      "squuid": "5be1a6b8-62f5-40a4-b6b4-28a2c19af65c",
      "state": "active"
    },
    {
      "type": "own",
      "capitalShares": 12.27,
      "holder": {
        "name": "Pfingsten, Ernst Andreas",
        "squuid": "5be1a6b6-9ec6-4eb2-9ada-59fae32f49b3"
      },
      "squuid": "5be1a6b8-c192-4c7a-9267-e9567c1e6d11",
      "state": "active"
    },
    {
      "type": "own",
      "capitalShares": 4.91,
      "holder": {
        "name": "Haak, Dr. Friedhelm",
        "squuid": "5be1a6b6-ef54-4097-82fd-faeb7654d658"
      },
      "squuid": "5be1a6b8-60ba-4551-b5f2-3dbb7fb42392",
      "state": "active"
    },
    {
      "type": "own",
      "capitalShares": 61.35,
      "holder": {
        "name": "Wilkening, Anne",
        "squuid": "5be1a6b6-89cd-41ec-b05d-59b3e59cb17d"
      },
      "squuid": "5be1a6b8-8157-42d6-97b1-8c52a4c96505",
      "state": "active"
    },
    {
      "type": "own",
      "capitalShares": 9.2,
      "holder": {
        "name": "Pfingsten, Christiane",
        "squuid": "5ebbff59-8d43-4eff-9f26-99368fef106f"
      },
      "squuid": "667171fc-a01a-46f1-a0e1-d8fac700bba7",
      "state": "active"
    }
  ]
}