{
  "owns": [
    {
      "type": "own",
      "capitalShares": 1.35,
      "held": {
        "name": "Mediengesellschaft der Bayerischen Tageszeitungen für Kabelkommunikation mbH & Co. - Radio 2000 KG",
        "squuid": "5be1a6b6-cc99-4fd3-96f9-d2ef9847c76f"
      },
      "squuid": "5be1a6b7-6e15-41e4-88b9-5524639d2cef",
      "state": "active"
    },
    {
      "type": "own",
      "capitalShares": 0.86,
      "held": {
        "name": "Mediengesellschaft der bayerischen Tageszeitungen für Kabelkommunikation mbH & Co. - Programm- und Werbegesellschaft",
        "squuid": "5be1a6b6-c525-4b11-a1b7-9969a9671afb"
      },
      "squuid": "5be1a6b7-1952-421f-91c6-f5d30c1e1296",
      "state": "active"
    },
    {
      "type": "own",
      "capitalShares": 20.0,
      "held": {
        "name": "Radio F Programm- und Werbegesellschaft mbH Nürnberg",
        "squuid": "5be1a6b6-a243-444e-b8c1-ef6403e3afda"
      },
      "squuid": "5be1a6b8-201b-4005-a2ad-124b8f2c93af",
      "state": "active"
    },
    {
      "type": "own",
      "capitalShares": 100.0,
      "held": {
        "name": "Emmy Riedel Buchdruckerei und Verlag GmbH",
        "squuid": "5be1a6b6-4388-4b34-b047-6e3d7f3b8ed5"
      },
      "squuid": "5eb295d5-960e-4cfd-a280-ae69634c69d4",
      "state": "active"
    },
    {
      "type": "own",
      "capitalShares": 100.0,
      "held": {
        "name": "Karl Müller vorm. Fr. Feuerlein GmbH",
        "squuid": "5be1a6b6-527d-4742-a385-1db8cda97605"
      },
      "squuid": "5ece7822-2eb7-473d-88a9-6ae9f31b724f",
      "state": "active"
    },
    {
      "type": "own",
      "capitalShares": 100.0,
      "held": {
        "name": "Millizer & Riedel GmbH",
        "squuid": "5be1a6b6-1576-49ad-a2a1-769cecc7a4a7"
      },
      "squuid": "5ee3619d-8fc6-4c7c-9610-863f2b70b111",
      "state": "active"
    },
    {
      "type": "own",
      "capitalShares": 100.0,
      "held": {
        "name": "J. Christian Leidel GmbH",
        "squuid": "5be1a6b6-1066-4e16-b274-b78c32e71974"
      },
      "squuid": "5ee38b6e-e270-468e-bf01-68e41176f722",
      "state": "active"
    },
    {
      "type": "own",
      "capitalShares": 100.0,
      "held": {
        "name": "Hersbrucker Zeitung GmbH Verlag und Medienservice",
        "squuid": "5ece622d-407b-4752-8c14-978522219ca4"
      },
      "squuid": "625fff12-cabb-4542-b3b8-1dbf3d1e0566",
      "state": "active"
    },
    {
      "type": "own",
      "capitalShares": 100.0,
      "held": {
        "name": "Pfeiffer Verlag und Medienservice GmbH & Co. KG",
        "squuid": "5be1a6b6-ef99-4634-836e-dfecf0d08f20"
      },
      "squuid": "625fff6d-6b06-411b-8fe4-109eb44fd045",
      "state": "active"
    }
  ],
  "state": "active",
  "city": "Nürnberg",
  "pseudoCompany": false,
  "street": "Marienstr. 9",
  "name": "Nordbayerische Verlagsgesellschaft mbH",
  "naturalPerson": false,
  "squuid": "5be1a6b6-c472-41cd-929b-92ddc54a0324",
  "controlDate": "2024-06-27T15:50:05.872Z",
  "organizations": [
    {
      "squuid": "5adf79c8-9f9e-4b59-a86f-7119603efa99",
      "name": "DL",
      "type": "organization"
    },
    {
      "squuid": "5adf79c9-1b57-44c7-a29d-9130ab140fa9",
      "name": "GGS",
      "type": "organization",
      "fullName": "Gemeinsame Geschaeftsstelle"
    },
    {
      "squuid": "5b0830c1-8ded-40dd-9d37-2a1a21efaff5",
      "name": "BLM",
      "type": "organization",
      "fullName": "Bayerische Landeszentrale für neue Medien"
    },
    {
      "squuid": "5b0830d9-f42f-4d90-b6c6-972961be484a",
      "name": "LMS",
      "type": "organization",
      "fullName": "Landesmedienanstalt Saarland"
    },
    {
      "squuid": "5b0830e0-995b-4e41-bc1e-678fbd483756",
      "name": "LFK",
      "type": "organization",
      "fullName": "Landesanstalt für Kommunikation Baden-Württemberg"
    },
    {
      "squuid": "5b0830ee-abe8-41d3-b591-862c1133d63d",
      "name": "SLM",
      "type": "organization",
      "fullName": "Sächsische Landesanstalt für privaten Rundfunk und neue Medien"
    },
    {
      "squuid": "5b0830f6-6588-43fb-93a8-d824a4663969",
      "name": "LFM NRW",
      "type": "organization",
      "fullName": "Landesanstalt für Medien Nordrhein-Westfalen"
    },
    {
      "squuid": "5b08310a-5980-45c0-b994-009426dae8df",
      "name": "MA HSH",
      "type": "organization",
      "fullName": "Medienanstalt Hamburg/Schleswig-Holstein"
    }
  ],
  "zipcode": "90402",
  "operates": [
    {
      "type": "operate",
      "held": {
        "name": "NZ Nürnberger Zeitung",
        "squuid": "5be1a6b1-4fa4-4509-94bd-bb65897514ea"
      },
      "squuid": "5be1a6b9-8034-46d6-92e3-3b6c4529c806",
      "state": "active"
    },
    {
      "type": "operate",
      "held": {
        "name": "NZ Nordbayerische Zeitung",
        "squuid": "5be1a6b1-ed23-4035-a9d2-56097c8934f2"
      },
      "squuid": "5be1a6b9-cef3-4fc7-aa8e-75f37bdb8b54",
      "state": "active"
    }
  ],
  "credits": "IJK",
  "ownedBy": [
    {
      "type": "own",
      "capitalShares": 100.0,
      "holder": {
        "name": "Pressehaus GmbH",
        "squuid": "5be1a6b6-e093-4174-9a60-584455023300"
      },
      "squuid": "5be1a6b8-4b36-4e9c-ace2-674c4d7eda7d",
      "state": "active"
    }
  ]
}