{
  "owns": [
    {
      "type": "own",
      "capitalShares": 1.84,
      "held": {
        "name": "Radio Welle Unterallgäu Lokaler Programmanbieter GmbH",
        "squuid": "5be1a6b6-7f46-4804-8f48-c3238bc93a9a"
      },
      "squuid": "5be1a6b7-dca2-4d8d-86ba-a1db13f4b83d",
      "state": "active"
    }
  ],
  "state": "active",
  "pseudoCompany": false,
  "name": "Constantin Programm/Intercom Handelsgesellschaft mbH",
  "naturalPerson": false,
  "squuid": "5be1a6b6-8c30-40a8-8f3b-e8b5cdff5b17",
  "organizations": [
    {
      "squuid": "5adf79c9-1b57-44c7-a29d-9130ab140fa9",
      "name": "GGS",
      "type": "organization",
      "fullName": "Gemeinsame Geschaeftsstelle"
    }
  ],
  "credits": "BLM-Schriftenreihe Band 83",
  "ownedBy": [
    {
      "type": "own",
      "capitalShares": 100.0,
      "holder": {
        "name": "Schäfers, Bernd",
        "squuid": "5be1a6b6-bd85-424b-81f9-bad011e2cfd4"
      },
      "squuid": "5be1a6b7-df80-4a0c-a741-c0a28efd1b83",
      "state": "active"
    }
  ]
}