{
  "owns": [
    {
      "type": "own",
      "capitalShares": 25.0,
      "held": {
        "name": "Fahner Familienbeteiligungsgesellschaft bR",
        "squuid": "5be1a6b6-76c9-4752-89d6-2802a7271609"
      },
      "squuid": "5be1a6b8-f04e-4ad9-82dc-9a416cd21dd0",
      "state": "active"
    },
    {
      "type": "own",
      "capitalShares": 5.26,
      "held": {
        "name": "Verlag Hans Fahner GmbH & Co KG",
        "squuid": "5be1a6b6-1d03-4bcb-9e43-4bf5c5e6aadd"
      },
      "squuid": "5d10c081-5821-4fbe-bc14-27212316979e",
      "state": "active"
    }
  ],
  "state": "active",
  "city": "Lauf",
  "pseudoCompany": false,
  "name": "Herrmann, Lambert",
  "naturalPerson": true,
  "squuid": "5be1a6b6-534d-4342-8583-e77c11d3ef08",
  "controlDate": "2019-06-19T15:18:30.116Z",
  "organizations": [
    {
      "squuid": "5adf79c8-9f9e-4b59-a86f-7119603efa99",
      "name": "DL",
      "type": "organization"
    },
    {
      "squuid": "5b0830ad-2ee5-49b4-b028-a4613bb01c2e",
      "name": "mabb",
      "type": "organization",
      "fullName": "Medienanstalt Berlin-Brandenburg"
    },
    {
      "squuid": "5b0830c1-8ded-40dd-9d37-2a1a21efaff5",
      "name": "BLM",
      "type": "organization",
      "fullName": "Bayerische Landeszentrale für neue Medien"
    },
    {
      "squuid": "5b0830d9-f42f-4d90-b6c6-972961be484a",
      "name": "LMS",
      "type": "organization",
      "fullName": "Landesmedienanstalt Saarland"
    },
    {
      "squuid": "5b0830e0-995b-4e41-bc1e-678fbd483756",
      "name": "LFK",
      "type": "organization",
      "fullName": "Landesanstalt für Kommunikation Baden-Württemberg"
    },
    {
      "squuid": "5b0830ee-abe8-41d3-b591-862c1133d63d",
      "name": "SLM",
      "type": "organization",
      "fullName": "Sächsische Landesanstalt für privaten Rundfunk und neue Medien"
    },
    {
      "squuid": "5b0830f6-6588-43fb-93a8-d824a4663969",
      "name": "LFM NRW",
      "type": "organization",
      "fullName": "Landesanstalt für Medien Nordrhein-Westfalen"
    },
    {
      "squuid": "5b08310a-5980-45c0-b994-009426dae8df",
      "name": "MA HSH",
      "type": "organization",
      "fullName": "Medienanstalt Hamburg/Schleswig-Holstein"
    }
  ],
  "credits": "IJK"
}