{
  "name": "Becker, Achim",
  "pseudoCompany": false,
  "squuid": "5be1a6b6-cea3-47bc-bd57-f0189dd97a5d",
  "credits": "Formatt",
  "organizations": [
    {
      "squuid": "5adf79c9-1b57-44c7-a29d-9130ab140fa9",
      "name": "GGS",
      "type": "organization",
      "fullName": "Gemeinsame Geschaeftsstelle"
    }
  ],
  "state": "archived",
  "naturalPerson": true
}