{
  "owns": [
    {
      "type": "own",
      "capitalShares": 47.0,
      "held": {
        "name": "Springer Nature AG & Co. KGaA",
        "squuid": "5be1a6b6-0de1-471f-a8f9-bf05cab69142"
      },
      "squuid": "5be1a6b8-e8b6-44e4-8105-eae335d148bd",
      "state": "active"
    }
  ],
  "state": "active",
  "city": "Luxembourg",
  "pseudoCompany": false,
  "name": "Springer Science + Business Media GP Acquisition S.C.A.",
  "naturalPerson": false,
  "squuid": "5be1a6b6-85cf-42bc-aae9-ae90ba292b7b",
  "controlDate": "2022-06-29T12:20:41.883Z",
  "organizations": [
    {
      "squuid": "5adf79c8-9f9e-4b59-a86f-7119603efa99",
      "name": "DL",
      "type": "organization"
    }
  ],
  "credits": "IJK"
}