{
  "name": "Wilhelm, Dirk Martin",
  "squuid": "68359e30-d518-4b2a-935f-944b9d8c60d0",
  "state": "active",
  "organizations": [
    {
      "squuid": "5adf79c9-1b57-44c7-a29d-9130ab140fa9",
      "name": "GGS",
      "type": "organization",
      "fullName": "Gemeinsame Geschaeftsstelle"
    }
  ]
}