{
  "owns": [
    {
      "type": "own",
      "capitalShares": 3.26,
      "held": {
        "name": "Antenne Thüringen GmbH & Co. KG",
        "squuid": "5be1a6b6-5864-4d2d-abd2-19cfbc09b41b"
      },
      "squuid": "5be1a6b7-8a85-4427-9a20-23f32e36e2de",
      "state": "active"
    }
  ],
  "state": "active",
  "city": "Weimar",
  "pseudoCompany": false,
  "street": "Marienstr. 14",
  "name": "Wartburg Verlag GmbH",
  "naturalPerson": false,
  "squuid": "5be1a6b6-0820-4da3-a7ee-fa181a4628f5",
  "controlDate": "2022-11-01T16:38:02.922Z",
  "organizations": [
    {
      "squuid": "5adf79c8-9f9e-4b59-a86f-7119603efa99",
      "name": "DL",
      "type": "organization"
    },
    {
      "squuid": "5b083104-06da-45cc-a97a-16cb34631424",
      "name": "TLM",
      "type": "organization",
      "fullName": "Thüringer Landesmedienanstalt"
    }
  ],
  "zipcode": "99423",
  "operates": [
    {
      "type": "operate",
      "held": {
        "name": "Glaube und Heimat",
        "squuid": "5be1a6b1-72ac-4dc8-97a6-903e0820e861"
      },
      "squuid": "5be1a6b9-4e48-42c3-9526-7be58f6d65e6",
      "state": "active"
    },
    {
      "type": "operate",
      "held": {
        "name": "www.glaube-und-heimat.de",
        "squuid": "5be1a6b1-7ec2-42f3-89e3-430178c41d86"
      },
      "squuid": "5be1a6b9-3d58-4019-b852-a1458072c302",
      "state": "active"
    }
  ],
  "credits": "IJK",
  "ownedBy": [
    {
      "type": "own",
      "capitalShares": 100.0,
      "holder": {
        "name": "Evangelisch-Lutherische Kirche in Thüringen",
        "squuid": "5be1a6b6-eb78-4034-8bfe-253721ea0019"
      },
      "squuid": "5be1a6b7-35d5-463f-b0d4-e117431364d9",
      "state": "active"
    }
  ]
}