{
  "state": "active",
  "city": "Biberach",
  "pseudoCompany": false,
  "name": "Diederich, Hildegard",
  "naturalPerson": true,
  "squuid": "5be1a6b6-7c92-4766-ab41-cf9f87e2dda4",
  "controlDate": "2019-06-20T14:21:15.160Z",
  "organizations": [
    {
      "squuid": "5adf79c9-1b57-44c7-a29d-9130ab140fa9",
      "name": "GGS",
      "type": "organization",
      "fullName": "Gemeinsame Geschaeftsstelle"
    }
  ],
  "credits": "IJK"
}