{
  "name": "von Löhneysen, Konrad",
  "pseudoCompany": false,
  "squuid": "5be1a6b6-2b7a-44c8-958e-bdeb4c782b7b",
  "owns": [
    {
      "type": "own",
      "capitalShares": 100.0,
      "held": {
        "name": "Embassy of Music GmbH",
        "squuid": "5be1a6b6-0306-4e50-b819-6d4317139843"
      },
      "squuid": "5be1a6b8-30a1-4fb2-aa91-0d288c28ab1f",
      "state": "active"
    }
  ],
  "city": "Berlin",
  "organizations": [
    {
      "squuid": "5adf79c8-9f9e-4b59-a86f-7119603efa99",
      "name": "DL",
      "type": "organization"
    },
    {
      "squuid": "5b0830ad-2ee5-49b4-b028-a4613bb01c2e",
      "name": "mabb",
      "type": "organization",
      "fullName": "Medienanstalt Berlin-Brandenburg"
    },
    {
      "squuid": "5b0830f6-6588-43fb-93a8-d824a4663969",
      "name": "LfM",
      "type": "organization",
      "fullName": "Landesanstalt für Medien Nordrhein-Westfalen"
    },
    {
      "squuid": "5b08310a-5980-45c0-b994-009426dae8df",
      "name": "MA HSH",
      "type": "organization",
      "fullName": "Medienanstalt Hamburg/Schleswig-Holstein"
    }
  ],
  "state": "active",
  "naturalPerson": true
}