{
  "owns": [
    {
      "type": "own",
      "capitalShares": 20.0,
      "held": {
        "name": "Radio 21 GmbH & Co. KG",
        "squuid": "5be1a6b6-d018-4147-bd70-c13114845f19"
      },
      "squuid": "5be1a6b7-5175-4d99-926a-85d9cfaa0d42",
      "state": "active"
    },
    {
      "type": "own",
      "capitalShares": 100.0,
      "held": {
        "name": "Antenne Niedersachsen Geschäftsführungs-GmbH",
        "squuid": "5ee897ae-bd50-427b-9fe7-319f148dbe5f"
      },
      "squuid": "5f0c1bf5-ba09-4384-b92e-d4df12c1740c",
      "state": "active"
    },
    {
      "type": "own",
      "capitalShares": 20.0,
      "held": {
        "name": "Radio 21 Beteiligungs GmbH",
        "squuid": "5efb0c4f-a0b8-450a-8e27-0eb6a666d272"
      },
      "squuid": "5f0d9e3f-92c9-44c5-8c6f-800c80017879",
      "state": "active"
    }
  ],
  "state": "active",
  "city": "Hannover",
  "pseudoCompany": false,
  "street": "Goseriede",
  "name": "Antenne Niedersachsen GmbH & Co. KG",
  "naturalPerson": false,
  "limitedPartnership": true,
  "squuid": "5be1a6b6-a997-45d6-8d9d-b0d0b50972f1",
  "controlDate": "2022-09-14T14:03:51.618Z",
  "streetNumber": "9",
  "organizations": [
    {
      "squuid": "5adf79c7-7ca3-4d7a-939c-d5a256934b27",
      "name": "KEK",
      "type": "organization"
    },
    {
      "squuid": "5adf79c8-9f9e-4b59-a86f-7119603efa99",
      "name": "DL",
      "type": "organization"
    },
    {
      "squuid": "5b0830f6-6588-43fb-93a8-d824a4663969",
      "name": "LfM",
      "type": "organization",
      "fullName": "Landesanstalt für Medien Nordrhein-Westfalen"
    },
    {
      "squuid": "5b083572-de6f-4f77-b1d0-15f08ed9a01c",
      "name": "NLM",
      "type": "organization",
      "fullName": "Niedersächsische Landesmedienanstalt"
    }
  ],
  "zipcode": "30159",
  "operates": [
    {
      "type": "operate",
      "held": {
        "name": "Antenne Niedersachsen",
        "squuid": "5be1a6b1-d481-40bf-a5e7-12ce78423667"
      },
      "squuid": "5be1a6b9-b1ff-44fe-9a3c-fa0344ce6d7e",
      "state": "active"
    },
    {
      "type": "operate",
      "held": {
        "name": "Antenne Niedersachsen Oldie",
        "squuid": "5be1a6b1-6edd-466f-972d-cdc4054230d4"
      },
      "squuid": "5be1a6b9-4954-433f-affe-1945d0645516",
      "state": "active"
    },
    {
      "type": "operate",
      "held": {
        "name": "Antenne Niedersachsen 80er",
        "squuid": "5be1a6b1-6f3e-4744-b348-4a2324509153"
      },
      "squuid": "5be1a6b9-3300-401a-8519-fa0c961145ec",
      "state": "active"
    },
    {
      "type": "operate",
      "held": {
        "name": "Antenne Niedersachsen 90er",
        "squuid": "5be1a6b1-653a-426f-8a6e-c07809847d67"
      },
      "squuid": "5be1a6b9-0908-4ca0-8a50-7402675c9b11",
      "state": "active"
    },
    {
      "type": "operate",
      "held": {
        "name": "Antenne Niedersachsen Rock",
        "squuid": "5be1a6b1-d09f-4a78-9028-169d065575ed"
      },
      "squuid": "5be1a6b9-4125-4be6-a64d-4ec1e7d1c3fe",
      "state": "active"
    },
    {
      "type": "operate",
      "held": {
        "name": "Antenne Niedersachsen Relax",
        "squuid": "5be1a6b1-fd3e-4f7e-96b2-e189afc91e7a"
      },
      "squuid": "5be1a6b9-5677-4ad0-af53-23e7a324b5b2",
      "state": "active"
    },
    {
      "type": "operate",
      "held": {
        "name": "Antenne Niedersachsen Charts",
        "squuid": "5be1a6b1-c2a9-468a-b390-0f40e030d19a"
      },
      "squuid": "5be1a6b9-5011-461b-8814-cde98e2b143f",
      "state": "active"
    },
    {
      "type": "operate",
      "held": {
        "name": "www.antenne.com",
        "squuid": "5c35ff0e-5882-41a8-97cd-ba491bcae636"
      },
      "squuid": "5c3606c7-fae7-42ec-acfc-a1f34f68ede3",
      "state": "active"
    }
  ],
  "credits": "www.nlm.de/fernsehen/lizenzierte-radio-veranstalter-unsichtbar/antenne-niedersachsen/ (Stand: 3/2018)",
  "ownedBy": [
    {
      "type": "own",
      "capitalShares": 49.9,
      "holder": {
        "name": "AVE Gesellschaft für Hörfunkbeteiligungen mbH",
        "squuid": "5be1a6b6-d3ab-4ac5-b3e4-c369a9a50248"
      },
      "squuid": "5be1a6b7-d235-465f-9101-c2c3ac8b6508",
      "state": "active"
    },
    {
      "type": "own",
      "capitalShares": 4.0,
      "holder": {
        "name": "NWZ Funk und Fernsehen GmbH & Co. KG",
        "squuid": "5be1a6b6-e74c-47af-9e67-66b48a57e0a8"
      },
      "squuid": "5be1a6b7-f6af-4e4f-a95b-7e7834813366",
      "state": "active"
    },
    {
      "type": "own",
      "capitalShares": 1.0,
      "holder": {
        "name": "Evangelischer Kirchenfunk Niedersachsen-Bremen GmbH",
        "squuid": "5be1a6b6-da6a-427b-993b-63aa55ab2a26"
      },
      "squuid": "5be1a6b7-5d62-45bc-ac47-3b87f696177e",
      "state": "active"
    },
    {
      "type": "own",
      "capitalShares": 1.0,
      "holder": {
        "name": "Tenzer, Harald",
        "squuid": "5be1a6b6-9edc-4180-8252-94ea5139681e"
      },
      "squuid": "5be1a6b7-99bd-4483-8ef8-04a853e036db",
      "state": "active"
    },
    {
      "type": "own",
      "capitalShares": 10.0,
      "holder": {
        "name": "Brune-Rieck-Beteiligungs-GmbH",
        "squuid": "5be1a6b6-2a2f-48d5-83cd-a5096f340537"
      },
      "squuid": "5be1a6b7-59f0-4d9d-9825-f4673afefa3b",
      "state": "active"
    },
    {
      "type": "own",
      "capitalShares": 19.0,
      "holder": {
        "name": "Studio Gong Niedersachsen GmbH & Co. Studiobetriebs KG",
        "squuid": "5be1a6b6-2762-4a2a-ac1b-ecf974d4494f"
      },
      "squuid": "5be1a6b7-5621-47d2-8a16-8b6b2d89d3bc",
      "state": "active"
    },
    {
      "type": "own",
      "capitalShares": 7.0,
      "holder": {
        "name": "Mediengesellschaft Mittelstand Niedersachsen GmbH",
        "squuid": "5be1a6b6-aa36-4fda-b5d5-42d08f3ab67e"
      },
      "squuid": "5be1a6b7-6124-4046-9bdc-55dc7541254a",
      "state": "active"
    },
    {
      "type": "own",
      "capitalShares": 0.5,
      "holder": {
        "name": "Dom Buchhandlung GmbH",
        "squuid": "5be1a6b6-6f18-497d-9634-96c8f0ddca80"
      },
      "squuid": "5be1a6b7-838a-4e24-97a8-6f4c25c728e9",
      "state": "active"
    },
    {
      "type": "own",
      "capitalShares": 0.5,
      "holder": {
        "name": "Bernward Mediengesellschaft mbH",
        "squuid": "5be1a6b6-8e7f-47f3-8dca-6064edc287cc"
      },
      "squuid": "5be1a6b7-9133-414a-a72c-eabe976c1c46",
      "state": "active"
    },
    {
      "type": "own",
      "capitalShares": 6.1,
      "holder": {
        "name": "Madsack Hörfunk GmbH",
        "squuid": "5be1a6b6-4add-4b03-bec9-315127c38099"
      },
      "squuid": "5be1a6b7-099c-4683-8eee-acb0d3aa0c47",
      "state": "active"
    },
    {
      "type": "own",
      "capitalShares": 1.0,
      "holder": {
        "name": "Medienpool 4 GmbH ",
        "squuid": "5d80ac94-d98a-4b31-8b94-be898e229a35"
      },
      "squuid": "5d80acc0-71a3-41f1-bec4-81bedceff5a9",
      "state": "active"
    },
    {
      "complementaryPartner": true,
      "type": "own",
      "capitalShares": 0.0,
      "holder": {
        "name": "Antenne Niedersachsen Geschäftsführungs-GmbH",
        "squuid": "5ee897ae-bd50-427b-9fe7-319f148dbe5f"
      },
      "squuid": "5ee897f5-0933-408f-b7f0-dfbce7d67fff",
      "state": "active"
    }
  ]
}