{
  "name": "Meyer-Vandenberg, Torsten",
  "pseudoCompany": false,
  "squuid": "5be1a6b6-4b28-43b1-8088-4bf2e38625f4",
  "owns": [
    {
      "type": "own",
      "capitalShares": 6.0,
      "held": {
        "name": "Concert Channel TV Beteiligungs-GmbH",
        "squuid": "5be1a6b6-ee60-4045-a179-11b6cd99da35"
      },
      "squuid": "5be1a6b7-f3c1-41ea-96d6-c8b3fd1eecce",
      "state": "active"
    }
  ],
  "organizations": [
    {
      "squuid": "5adf79c9-1b57-44c7-a29d-9130ab140fa9",
      "name": "GGS",
      "type": "organization",
      "fullName": "Gemeinsame Geschaeftsstelle"
    }
  ],
  "state": "active",
  "naturalPerson": true
}