{
  "name": "Stadt Hagen",
  "pseudoCompany": true,
  "squuid": "5f16b9de-035d-4dd3-8104-9eccebb90e19",
  "owns": [
    {
      "type": "own",
      "capitalShares": 100.0,
      "held": {
        "name": "Hagener Versorgungs- und Verkehrsgesellschaft mbH",
        "squuid": "5be1a6b6-d2c4-4d39-a353-f6df09fdf92d"
      },
      "squuid": "5f16ba0c-88f0-45e6-a62e-cb363edead16",
      "state": "active"
    }
  ],
  "organizations": [
    {
      "squuid": "5adf79c8-9f9e-4b59-a86f-7119603efa99",
      "name": "DL",
      "type": "organization"
    },
    {
      "squuid": "5b0830f6-6588-43fb-93a8-d824a4663969",
      "name": "LfM",
      "type": "organization",
      "fullName": "Landesanstalt f√ºr Medien Nordrhein-Westfalen"
    }
  ],
  "state": "active",
  "naturalPerson": false
}