{
  "owns": [
    {
      "complementaryPartner": true,
      "type": "own",
      "capitalShares": 0.0,
      "held": {
        "name": "Wort & Bild Verlag Konradshöhe GmbH & Co KG",
        "squuid": "5c4ecea1-ed74-4078-9449-fb2e2671fc19"
      },
      "squuid": "5eb3f271-4b2f-457e-afd5-4cd09ebb9845",
      "state": "active"
    }
  ],
  "state": "active",
  "city": "Baierbrunn",
  "pseudoCompany": false,
  "street": "Konradshöhe",
  "name": "Verlag Konradshöhe GmbH",
  "naturalPerson": false,
  "squuid": "5eb3f240-e715-4f80-98a9-52bc74e67f34",
  "controlDate": "2024-07-12T12:34:33.062Z",
  "streetNumber": "1",
  "organizations": [
    {
      "squuid": "5adf79c8-9f9e-4b59-a86f-7119603efa99",
      "name": "DL",
      "type": "organization"
    }
  ],
  "zipcode": "82065",
  "ownedBy": [
    {
      "type": "own",
      "capitalShares": 100.0,
      "holder": {
        "name": "Isartalmedien GmbH & Co KG",
        "squuid": "5c4ed82a-a196-4c5d-92da-885a88f6c18a"
      },
      "squuid": "5eb3f320-cfa2-4a02-983a-e0bc718cd14b",
      "state": "active"
    }
  ]
}