{
  "state": "archived",
  "city": "München",
  "pseudoCompany": false,
  "street": "Leopoldstraße 236",
  "name": "Shopping Guide GmbH",
  "naturalPerson": false,
  "squuid": "5be1a6b6-e756-467f-ab49-825ff34b5425",
  "otherMediaActivities": "Betreiber des Online-Angebotes www.ciao.de (Bewertungsplattform/Shopping-Guide)",
  "organizations": [
    {
      "squuid": "5adf79c9-1b57-44c7-a29d-9130ab140fa9",
      "name": "GGS",
      "type": "organization",
      "fullName": "Gemeinsame Geschaeftsstelle"
    }
  ],
  "zipcode": "80807",
  "credits": "Formatt"
}