{
  "owns": [
    {
      "type": "own",
      "capitalShares": 5.45,
      "held": {
        "name": "Rock Hard Verlags- und Handelsgesellschaft mbH",
        "squuid": "5be1a6b6-6eca-4e7a-bbbf-cc539e3ec75a"
      },
      "squuid": "5be1a6b8-bd95-4bb5-80e3-2a193b49c612",
      "state": "active"
    }
  ],
  "state": "active",
  "city": "Köln",
  "pseudoCompany": false,
  "name": "Büchner, Stefan",
  "naturalPerson": true,
  "squuid": "5be1a6b6-ee9e-48b1-8364-03c6de6643e3",
  "controlDate": "2019-06-21T12:14:15.244Z",
  "organizations": [
    {
      "squuid": "5adf79c8-9f9e-4b59-a86f-7119603efa99",
      "name": "DL",
      "type": "organization"
    }
  ],
  "credits": "IJK"
}